{
  "schema": "coursecraft.blueprint/5",
  "template_reference": "Brightspace course blueprint review format",
  "course_number": "SAMPLE 100",
  "course_title": "Sample Course",
  "term": "Demo Term",
  "front_matter": {
    "course_description": [
      {
        "kind": "p",
        "level": 0,
        "runs": [
          {
            "text": "This synthetic course helps reviewers inspect how Brightspace export evidence becomes a readable blueprint.",
            "href": ""
          }
        ]
      }
    ],
    "required_materials": [
      {
        "kind": "li",
        "level": 1,
        "runs": [
          {
            "text": "Open readings linked from each weekly module.",
            "href": ""
          }
        ]
      },
      {
        "kind": "li",
        "level": 1,
        "runs": [
          {
            "text": "A planning worksheet supplied as a downloadable course file.",
            "href": ""
          }
        ]
      }
    ],
    "course_learning_outcomes": [
      {
        "kind": "li",
        "level": 1,
        "runs": [
          {
            "text": "Identify the structure of a Brightspace course export.",
            "href": ""
          }
        ]
      },
      {
        "kind": "li",
        "level": 1,
        "runs": [
          {
            "text": "Trace course objects from manifest placement to review output.",
            "href": ""
          }
        ]
      },
      {
        "kind": "li",
        "level": 1,
        "runs": [
          {
            "text": "Distinguish extracted evidence from missing or hidden content.",
            "href": ""
          }
        ]
      }
    ],
    "course_introduction": [
      {
        "kind": "p",
        "level": 0,
        "runs": [
          {
            "text": "Welcome to the synthetic blueprint review course. This page demonstrates course-level introduction extraction.",
            "href": ""
          }
        ]
      }
    ]
  },
  "before_week_1": [
    {
      "label": "Course Description",
      "blocks": [
        {
          "kind": "p",
          "level": 0,
          "runs": [
            {
              "text": "This synthetic course helps reviewers inspect how Brightspace export evidence becomes a readable blueprint.",
              "href": ""
            }
          ]
        }
      ],
      "source_page": "Course Description",
      "level": 0,
      "module": "Getting Started"
    },
    {
      "label": "Course Materials",
      "blocks": [
        {
          "kind": "label",
          "level": 1,
          "runs": [
            {
              "text": "Required Materials:",
              "href": ""
            }
          ]
        },
        {
          "kind": "li",
          "level": 1,
          "runs": [
            {
              "text": "Open readings linked from each weekly module.",
              "href": ""
            }
          ]
        },
        {
          "kind": "li",
          "level": 1,
          "runs": [
            {
              "text": "A planning worksheet supplied as a downloadable course file.",
              "href": ""
            }
          ]
        }
      ],
      "source_page": "Course Materials",
      "level": 0,
      "module": "Getting Started"
    },
    {
      "label": "Course Learning Outcomes",
      "blocks": [
        {
          "kind": "li",
          "level": 1,
          "runs": [
            {
              "text": "Identify the structure of a Brightspace course export.",
              "href": ""
            }
          ]
        },
        {
          "kind": "li",
          "level": 1,
          "runs": [
            {
              "text": "Trace course objects from manifest placement to review output.",
              "href": ""
            }
          ]
        },
        {
          "kind": "li",
          "level": 1,
          "runs": [
            {
              "text": "Distinguish extracted evidence from missing or hidden content.",
              "href": ""
            }
          ]
        }
      ],
      "source_page": "Course Learning Outcomes",
      "level": 0,
      "module": "Getting Started"
    },
    {
      "label": "Project Roadmap and Setup",
      "blocks": [
        {
          "kind": "p",
          "level": 0,
          "runs": [
            {
              "text": "This pre-week page should render before Week 1 instead of being forced into a weekly module.",
              "href": ""
            }
          ]
        },
        {
          "kind": "label",
          "level": 2,
          "runs": [
            {
              "text": "Milestones:",
              "href": ""
            }
          ]
        },
        {
          "kind": "li",
          "level": 1,
          "runs": [
            {
              "text": "Review the course overview.",
              "href": ""
            }
          ],
          "meta": {
            "list": "ordered"
          }
        },
        {
          "kind": "li",
          "level": 1,
          "runs": [
            {
              "text": "Confirm the activity joins.",
              "href": ""
            }
          ],
          "meta": {
            "list": "ordered"
          }
        },
        {
          "kind": "li",
          "level": 1,
          "runs": [
            {
              "text": "Flag missing fields for human review.",
              "href": ""
            }
          ],
          "meta": {
            "list": "ordered"
          }
        },
        {
          "kind": "label",
          "level": 2,
          "runs": [
            {
              "text": "Tooling Notes:",
              "href": ""
            }
          ]
        },
        {
          "kind": "p",
          "level": 0,
          "runs": [
            {
              "text": "The bundle also emits inventory, manifest probe, course structure, activity workbook, QA, JSON, Markdown, and DOCX outputs.",
              "href": ""
            }
          ]
        }
      ],
      "source_page": "Project Roadmap and Setup",
      "level": 0,
      "module": "Getting Started"
    }
  ],
  "weeks": [
    {
      "title": "Week 1",
      "overview": [
        {
          "kind": "label",
          "level": 1,
          "runs": [
            {
              "text": "Week 1 Overview:",
              "href": ""
            }
          ]
        },
        {
          "kind": "p",
          "level": 0,
          "runs": [
            {
              "text": "This week introduces source tracing and module placement.",
              "href": ""
            }
          ]
        },
        {
          "kind": "label",
          "level": 2,
          "runs": [
            {
              "text": "Required Resources:",
              "href": ""
            }
          ]
        },
        {
          "kind": "p",
          "level": 0,
          "runs": [
            {
              "text": "This resource-like heading intentionally remains in Overview because Week 1 also has a separate Learning Materials page.",
              "href": ""
            }
          ]
        },
        {
          "kind": "visual",
          "level": 0,
          "runs": [
            {
              "text": "Callout",
              "href": ""
            }
          ],
          "meta": {
            "tag": "aside",
            "classes": "callout"
          },
          "blocks": [
            {
              "kind": "p",
              "level": 0,
              "runs": [
                {
                  "text": "Visual callout cue: reviewers should see this as a callout marker, not exact Brightspace styling.",
                  "href": ""
                }
              ]
            }
          ]
        },
        {
          "kind": "dropdown",
          "level": 0,
          "runs": [
            {
              "text": "Expandable instructor note",
              "href": ""
            }
          ],
          "blocks": [
            {
              "kind": "p",
              "level": 0,
              "runs": [
                {
                  "text": "Dropdown content is preserved as a review cue.",
                  "href": ""
                }
              ]
            }
          ]
        },
        {
          "kind": "image",
          "level": 0,
          "runs": [
            {
              "text": "Planning cycle diagram",
              "href": "../assets/planning-cycle.png"
            }
          ],
          "meta": {
            "alt": "Planning cycle diagram",
            "src": "../assets/planning-cycle.png"
          }
        },
        {
          "kind": "image",
          "level": 0,
          "runs": [
            {
              "text": "No alt text",
              "href": "../assets/equation-screenshot.png"
            }
          ],
          "meta": {
            "src": "../assets/equation-screenshot.png",
            "missing_alt": "true"
          }
        },
        {
          "kind": "divider",
          "level": 0,
          "runs": []
        },
        {
          "kind": "p",
          "level": 0,
          "runs": [
            {
              "text": "After the divider, the page continues with authored prose.",
              "href": ""
            }
          ]
        }
      ],
      "learning_objectives": [
        {
          "kind": "li",
          "level": 1,
          "runs": [
            {
              "text": "Explain how manifest items become weekly blueprint rows.",
              "href": ""
            }
          ]
        },
        {
          "kind": "li",
          "level": 1,
          "runs": [
            {
              "text": "Recognize hidden and unplaced D2L objects in diagnostics.",
              "href": ""
            }
          ]
        }
      ],
      "resources": [
        {
          "label": "Week 1 Learning Materials and Resources",
          "blocks": [
            {
              "kind": "p",
              "level": 0,